id,name,type,publisher,synopsis,released,img_link,avg_rating,qtd_rating
0,Mob Psycho 100 II,anime,Bones,"Shigeo ""Mob"" Kageyama is now maturing and understanding his role as a supernatural psychic that has the power to drastically affect the livelihood of others. He and his mentor Reigen Arataka continue to deal with supernatural requests from clients, whether it be exorcizing evil spirits or tackling urban legends that haunt the citizens. While the workflow remains the same, Mob isn't just blindly following Reigen around anymore. With all his experiences as a ridiculously strong psychic, Mob's supernatural adventures now have more weight to them. Things take on a serious and darker tone as the dangers Mob and Reigen face are much more tangible and unsettling than ever before. [Written by MAL Rewrite]",2019-01-07,https://cdn.myanimelist.net/images/anime/1918/96303.jpg,8.82,675966.0
1,Mushishi Zoku Shou 2nd Season,anime,Artland,"Ghostly, primordial beings known as Mushi continue to cause mysterious changes in the lives of humans. The travelling Mushishi, Ginko, persists in trying to set right the strange and unsettling situations he encounters. Time loops, living shadows, and telepathy are among the overt effects of interference from Mushi, but more subtle symptoms that take years to be noticed also rouse Ginko's concern as he passes from village to village. Through circumstance, Ginko has become an arbiter, determining which Mushi are blessings and which are curses. But the lines that he seeks to draw are subjective. Some of his patients would rather exercise their new powers until they are utterly consumed by them; others desperately strive to rid themselves of afflictions which are in fact protecting their lives from devastation. Those who cross paths with Mushi must learn to accept seemingly impossible consequences for their actions, and heal wounds they did not know they had. Otherwise, they risk meeting with fates beyond their comprehension. [Written by MAL Rewrite]",2014-10-19,https://cdn.myanimelist.net/images/anime/9/68095.jpg,8.75,87059.0
2,Steins;Gate,anime,White Fox,"The self-proclaimed mad scientist Rintarou Okabe rents out a room in a rickety old building in Akihabara, where he indulges himself in his hobby of inventing prospective ""future gadgets"" with fellow lab members: Mayuri Shiina, his air-headed childhood friend, and Hashida Itaru, a perverted hacker nicknamed ""Daru."" The three pass the time by tinkering with their most promising contraption yet, a machine dubbed the ""Phone Microwave,"" which performs the strange function of morphing bananas into piles of green gel. Though miraculous in itself, the phenomenon doesn't provide anything concrete in Okabe's search for a scientific breakthrough; that is, until the lab members are spurred into action by a string of mysterious happenings before stumbling upon an unexpected success—the Phone Microwave can send emails to the past, altering the flow of history. Adapted from the critically acclaimed visual novel by 5pb. and Nitroplus, Steins;Gate takes Okabe through the depths of scientific theory and practicality. Forced across the diverging threads of past and present, Okabe must shoulder the burdens that come with holding the key to the realm of time. [Written by MAL Rewrite]",2011-04-06,https://cdn.myanimelist.net/images/anime/5/73199.jpg,9.09,1122368.0
3,Mushoku Tensei: Jobless Reincarnation,anime,Studio Bind,"After the mysterious mana calamity, Rudeus Greyrat and his fierce student Eris Boreas Greyrat are teleported to the Demon Continent. There, they team up with their newfound companion Ruijerd Supardia—the former leader of the Superd's Warrior group—to form ""Dead End,"" a successful adventurer party. Making a name for themselves, the trio journeys across the continent to make their way back home to Fittoa. Following the advice he received from the faceless god Hitogami, Rudeus saves Kishirika Kishirisu, the Great Emperor of the Demon World, who rewards him by granting him a strange power. Now, as Rudeus masters the powerful ability that offers a number of new opportunities, it might prove to be more than what he bargained for when unexpected dangers threaten to hinder their travels. [Written by MAL Rewrite]",2021-10-04,https://cdn.myanimelist.net/images/anime/1028/117777.jpg,8.66,71656.0
4,Made in Abyss: Dawn of the Deep Soul,anime,Kinema Citrus,"Continuing their perilous descent down the Abyss, Riko, Regu, and newfound friend Nanachi reach the Abyss' fifth layer, The Sea of Corpses. Upon arriving at the research station known as Idofront, the main trio encounter the mysterious Prushka, the alleged daughter of Bondrewd, who leads them to the White Whistle responsible for Nanachi's dark past. Despite the welcoming appearances of Idofront's residents, Nanachi warns the young adventurers that things are not always what they seem. With the only route to the sixth layer shrouded in mystery and Bonedrewd's schemes awaiting them, what sacrifices must be made in order to continue the journey down to the bottom of the Abyss? [Written by MAL Rewrite]",2020-01-17,https://cdn.myanimelist.net/images/anime/1502/110723.jpg,8.69,119873.0
5,Ranking of Kings,anime,Wit Studio,"The people of the kingdom look down on the young Prince Bojji, who can neither hear nor speak. They call him ""The Useless Prince"" while jeering at his supposed foolishness. However, while Bojji may not be physically strong, he is certainly not weak of heart. When a chance encounter with a shadow creature should have left him traumatized, it instead makes him believe that he has found a friend amidst those who only choose to notice his shortcomings. He starts meeting with Kage, the shadow, regularly, to the point where even the otherwise abrasive creature begins to warm up to him. Kage and Bojji's unlikely friendship lays the budding foundations of the prince's journey, one where he intends to conquer his fears and insecurities. Despite the constant ridicule he faces, Bojji resolves to fulfill his desire of becoming the best king he can be. [Written by MAL Rewrite]",2021-10-15,https://cdn.myanimelist.net/images/anime/1347/117616.jpg,8.84,25594.0
6,Natsume's Book of Friends Season 4,anime,Brain's Base,"Takashi Natsume, the timid youkai expert and master of the Book of Friends, continues his journey towards self-understanding and acceptance with the help of friends both new and old. His most important ally is still his gluttonous and sake-loving bodyguard, the arrogant but fiercely protective wolf spirit Madara—or Nyanko-sensei, as Madara is called when in his usual disguise of an unassuming, pudgy cat. Natsume, while briefly separated from Nyanko-sensei, is ambushed and kidnapped by a strange group of masked, monkey-like youkai, who have spirited him away to their forest as they desperately search for the Book of Friends. Realizing that his ""servant"" has been taken out from right under his nose, Nyanko-sensei enlists the help of Natsume's youkai friends and mounts a rescue operation. However, the forest of the monkey spirits holds many dangerous enemies, including the Matoba Clan, Natsume's old nemesis. Stretching from the formidable hideout of the Matoba to Natsume's own childhood home, Natsume Yuujinchou Shi is a sweeping but familiar return to a world of danger and friendship, where Natsume will finally confront the demons of his own past. [Written by MAL Rewrite]",2012-01-03,https://cdn.myanimelist.net/images/anime/3/37449.jpg,8.66,93582.0
7,Gurren Lagann The Movie: The Lights in the Sky are Stars,anime,Gainax,"Humans have enjoyed their lavish, peaceful, and prosperous lives for seven years since the day the almighty Spiral King was defeated—the day they reclaimed their homeland, Earth. However, the boon of this lifestyle leaves them unprepared when an unknown, hostile threat arises due to the ever-growing human population. This calamity is the Anti-Spiral—a fearsome enemy with unparalleled power. As the Spiral King's prognosis postulating the destruction of ""The Spiral's World"" begins to come true, the pieces are in place, and Team Dai-Gurren is ready. With his late brother's hope to see a better future for mankind, Simon—along with Nia Teppelin and the rest of the team—is determined to overthrow the mighty Anti-Spiral in order to revive humanity's lost hope. [Written by MAL Rewrite]",2009-04-22,https://cdn.myanimelist.net/images/anime/12/19698.jpg,8.57,86288.0
8,Neon Genesis Evangelion: The End of Evangelion,anime,Gainax,"Shinji Ikari is left emotionally comatose after the death of a dear friend. With his son mentally unable to pilot the humanoid robot Evangelion Unit-01, Gendou Ikari's NERV races against the shadow organization SEELE to see who can enact their ultimate plan first. SEELE desires to create a godlike being by fusing their own souls into an Evangelion unit, while Gendou wishes to revert all of humanity into one primordial being so that he can be reunited with Yui, his deceased wife. SEELE unleashes its military forces in a lethal invasion of NERV headquarters. As SEELE's forces cut down NERV's scientists and security personnel, Asuka Langley Souryuu pilots Evangelion Unit-02 in a desperate last stand against SEELE's heaviest weaponry. The battle rages on, and a depressed Shinji hides deep within NERV's headquarters. With the fate of the world resting in Shinji's hands, Captain Misato Katsuragi hunts for the teenage boy as society crumbles around them. [Written by MAL Rewrite]",1997-07-19,https://cdn.myanimelist.net/images/anime/1404/98182.jpg,8.54,476287.0
9,Fullmetal Alchemist: Brotherhood,anime,Bones,"After a horrific alchemy experiment goes wrong in the Elric household, brothers Edward and Alphonse are left in a catastrophic new reality. Ignoring the alchemical principle banning human transmutation, the boys attempted to bring their recently deceased mother back to life. Instead, they suffered brutal personal loss: Alphonse's body disintegrated while Edward lost a leg and then sacrificed an arm to keep Alphonse's soul in the physical realm by binding it to a hulking suit of armor. The brothers are rescued by their neighbor Pinako Rockbell and her granddaughter Winry. Known as a bio-mechanical engineering prodigy, Winry creates prosthetic limbs for Edward by utilizing ""automail,"" a tough, versatile metal used in robots and combat armor. After years of training, the Elric brothers set off on a quest to restore their bodies by locating the Philosopher's Stone—a powerful gem that allows an alchemist to defy the traditional laws of Equivalent Exchange. As Edward becomes an infamous alchemist and gains the nickname ""Fullmetal,"" the boys' journey embroils them in a growing conspiracy that threatens the fate of the world. [Written by MAL Rewrite]",2009-04-05,https://cdn.myanimelist.net/images/anime/1223/96541.jpg,9.15,1639865.0
10,Evangelion: 3.0+1.0 Thrice Upon a Time,anime,Khara,"Shinji Ikari is still adrift after losing his will to live, but the place he arrives at teaches him what it means to hope. Finally, the Instrumentality Project is set in motion and Wille make one last grueling stand to prevent the Final Impact. (Source: IMDB)",2021-03-08,https://cdn.myanimelist.net/images/anime/1422/113533.jpg,8.68,71686.0
11,Death Note,anime,Madhouse,"A shinigami, as a god of death, can kill any person—provided they see their victim's face and write their victim's name in a notebook called a Death Note. One day, Ryuk, bored by the shinigami lifestyle and interested in seeing how a human would use a Death Note, drops one into the human realm. High school student and prodigy Light Yagami stumbles upon the Death Note and—since he deplores the state of the world—tests the deadly notebook by writing a criminal's name in it. When the criminal dies immediately following his experiment with the Death Note, Light is greatly surprised and quickly recognizes how devastating the power that has fallen into his hands could be. With this divine capability, Light decides to extinguish all criminals in order to build a new world where crime does not exist and people worship him as a god. Police, however, quickly discover that a serial killer is targeting criminals and, consequently, try to apprehend the culprit. To do this, the Japanese investigators count on the assistance of the best detective in the world: a young and eccentric man known only by the name of L. [Written by MAL Rewrite]",2006-10-04,https://cdn.myanimelist.net/images/anime/9/9453.jpg,8.63,2191877.0
12,Link Click,anime,Studio LAN,"It is said that a picture is worth a thousand words. In this case, it holds an infinite amount of secrets. These are secrets that only Cheng Xiaoshi and Lu Guang are able to find. In a small shop called ""Time Photo Studio,"" the two friends provide a special service: using their extraordinary powers that let them enter photographs, they jump into pictures brought to them by clients in order to grant their wishes. Through the eyes of the photographer, they live through the events surrounding the picture and try to decipher how to solve their client's request. But every time they jump into a picture, they take a great risk. One wrong move and they could alter the future of the person who took the picture... and possibly countless other events too. So when the events they are forced to live through in these pictures start to become personal, it will take the utmost strength to push their feelings aside and focus on accomplishing the task they were paid to do. [Written by MAL Rewrite]",2021-04-3,https://cdn.myanimelist.net/images/anime/1135/114867.jpg,8.84,36739.0
13,Fate/stay night: Heaven's Feel - II. Lost Butterfly,anime,ufotable,"The Fifth Holy Grail War continues, and the ensuing chaos results in higher stakes for all participants. Shirou Emiya continues to participate in the war, aspiring to be a hero of justice who saves everyone. He sets out in search of the truth behind a mysterious dark shadow and its murder spree, determined to defeat it. Meanwhile, Shinji Matou sets his own plans into motion, threatening Shirou through his sister Sakura Matou. Shirou and Rin Toosaka battle Shinji, hoping to relieve Sakura from the abuses of her brother. But the ugly truth of the Matou siblings begins to surface, and many dark secrets are exposed. Fate/stay night Movie: Heaven's Feel - II. Lost Butterfly continues to focus on the remaining Masters and Servants as they fight each other in the hopes of obtaining the Holy Grail. However, as darkness arises within Fuyuki City, even the state of their sacred war could be in danger. [Written by MAL Rewrite]",2019-01-12,https://cdn.myanimelist.net/images/anime/1974/98158.jpg,8.55,157495.0
14,Gintama Movie 2: Kanketsu-hen - Yorozuya yo Eien Nare,anime,Sunrise,"When Gintoki apprehends a movie pirate at a premiere, he checks the camera's footage and finds himself transported to a bleak, post-apocalyptic version of Edo, where a mysterious epidemic called the ""White Plague"" has ravished the world's population. It turns out that the movie pirate wasn't a pirate after all—it was an android time machine, and Gintoki has been hurtled five years into the future! Shinpachi and Kagura, his Yorozuya cohorts, have had a falling out and are now battle-hardened solo vigilantes and he himself has been missing for years, disappearing without a trace after scribbling a strange message in his journal. Setting out in the disguise given to him by the android time machine, Gintoki haphazardly reunites the Yorozuya team to investigate the White Plague, and soon discovers that the key to saving the future lies in the darkness of his own past. Determined to confront a powerful foe, he makes an important discovery—with a ragtag band of friends and allies at his side, he doesn't have to fight alone. [Written by MAL Rewrite]",2013-07-06,https://cdn.myanimelist.net/images/anime/10/51723.jpg,8.94,111621.0
15,Attack on Titan Season 3 Part 2,anime,Wit Studio,"Seeking to restore humanity's diminishing hope, the Survey Corps embark on a mission to retake Wall Maria, where the battle against the merciless ""Titans"" takes the stage once again. Returning to the tattered Shiganshina District that was once his home, Eren Yeager and the Corps find the town oddly unoccupied by Titans. Even after the outer gate is plugged, they strangely encounter no opposition. The mission progresses smoothly until Armin Arlert, highly suspicious of the enemy's absence, discovers distressing signs of a potential scheme against them. Shingeki no Kyojin Season 3 Part 2 follows Eren as he vows to take back everything that was once his. Alongside him, the Survey Corps strive—through countless sacrifices—to carve a path towards victory and uncover the secrets locked away in the Yeager family's basement. [Written by MAL Rewrite]",2019-04-29,https://cdn.myanimelist.net/images/anime/1517/100633.jpg,9.09,1108307.0
16,Monster,anime,Madhouse,"Dr. Kenzou Tenma, an elite neurosurgeon recently engaged to his hospital director's daughter, is well on his way to ascending the hospital hierarchy. That is until one night, a seemingly small event changes Dr. Tenma's life forever. While preparing to perform surgery on someone, he gets a call from the hospital director telling him to switch patients and instead perform life-saving brain surgery on a famous performer. His fellow doctors, fiancée, and the hospital director applaud his accomplishment; but because of the switch, a poor immigrant worker is dead, causing Dr. Tenma to have a crisis of conscience. So when a similar situation arises, Dr. Tenma stands his ground and chooses to perform surgery on the young boy Johan Liebert instead of the town's mayor. Unfortunately, this choice leads to serious ramifications for Dr. Tenma—losing his social standing being one of them. However, with the mysterious death of the director and two other doctors, Dr. Tenma's position is restored. With no evidence to convict him, he is released and goes on to attain the position of hospital director. Nine years later when Dr. Tenma saves the life of a criminal, his past comes back to haunt him—once again, he comes face to face with the monster he operated on. He must now embark on a quest of pursuit to make amends for the havoc spread by the one he saved. [Written by MAL Rewrite]",2004-04-07,https://cdn.myanimelist.net/images/anime/10/18793.jpg,8.81,246331.0
17,Princess Mononoke,anime,Studio Ghibli,"When an Emishi village is attacked by a fierce demon boar, the young prince Ashitaka puts his life at stake to defend his tribe. With its dying breath, the beast curses the prince's arm, granting him demonic powers while gradually siphoning his life away. Instructed by the village elders to travel westward for a cure, Ashitaka arrives at Tatara, the Iron Town, where he finds himself embroiled in a fierce conflict: Lady Eboshi of Tatara, promoting constant deforestation, stands against Princess San and the sacred spirits of the forest, who are furious at the destruction brought by the humans. As the opposing forces of nature and mankind begin to clash in a desperate struggle for survival, Ashitaka attempts to seek harmony between the two, all the while battling the latent demon inside of him. Princess Mononoke is a tale depicting the connection of technology and nature, while showing the path to harmony that could be achieved by mutual acceptance. [Written by MAL Rewrite]",1997-07-12,https://cdn.myanimelist.net/images/anime/7/75919.jpg,8.69,660001.0
18,Mushishi Zoku Shou: Suzu no Shizuku,anime,Artland,"On a warm summer day, a boy heard the sound of bells ringing, as if in celebration, in the mountain near his home. Several years later in that same mountain, the mushishi Ginko encounters a strange girl with weeds growing out of her body. Soon after, Ginko coincidentally runs into the now grown-up boy Yoshiro on his way off the mountain. With Yoshiro’s help, Ginko soon begins to uncover who this mysterious girl is and what happened to her. An adaptation of the last arc in the manga, Mushishi Zoku Shou: Suzu no Shizuku follows Ginko’s peculiar journey amidst the occult to unravel the mystery behind the enigmatic girl called Kaya and the mountain that has become her home. [Written by MAL Rewrite]",2015-05-16,https://cdn.myanimelist.net/images/anime/9/72689.jpg,8.61,42123.0
19,I want to eat your pancreas,anime,Studio VOLN,"The aloof protagonist: a bookworm who is deeply detached from the world he resides in. He has no interest in others and is firmly convinced that nobody has any interest in him either. His story begins when he stumbles across a handwritten book, titled ""Living with Dying."" He soon identifies it as a secret diary belonging to his popular, bubbly classmate Sakura Yamauchi. She then confides in him about the pancreatic disease she is suffering from and that her time left is finite. Only her family knows about her terminal illness; not even her best friends are aware. Despite this revelation, he shows zero sympathy for her plight, but caught in the waves of Sakura's persistent buoyancy, he eventually concedes to accompanying her for her remaining days. As the pair of polar opposites interact, their connection strengthens, interweaving through their choices made with each passing day. Her apparent nonchalance and unpredictability disrupts the protagonist's impassive flow of life, gradually opening his heart as he discovers and embraces the true meaning of living. [Written by MAL Rewrite]",2018-09-01,https://cdn.myanimelist.net/images/anime/1768/93291.jpg,8.58,390890.0
20,Violet Evergarden,anime,Kyoto Animation,"The Great War finally came to an end after four long years of conflict; fractured in two, the continent of Telesis slowly began to flourish once again. Caught up in the bloodshed was Violet Evergarden, a young girl raised for the sole purpose of decimating enemy lines. Hospitalized and maimed in a bloody skirmish during the War's final leg, she was left with only words from the person she held dearest, but with no understanding of their meaning. Recovering from her wounds, Violet starts a new life working at CH Postal Services after a falling out with her new intended guardian family. There, she witnesses by pure chance the work of an ""Auto Memory Doll,"" amanuenses that transcribe people's thoughts and feelings into words on paper. Moved by the notion, Violet begins work as an Auto Memory Doll, a trade that will take her on an adventure, one that will reshape the lives of her clients and hopefully lead to self-discovery. [Written by MAL Rewrite]",2018-01-11,https://cdn.myanimelist.net/images/anime/1795/95088.jpg,8.66,705454.0
21,Fate/Zero Season 2,anime,ufotable,"As the Fourth Holy Grail War rages on with no clear victor in sight, the remaining Servants and their Masters are called upon by Church supervisor Risei Kotomine, in order to band together and confront an impending threat that could unravel the Grail War and bring about the destruction of Fuyuki City. The uneasy truce soon collapses as Masters demonstrate that they will do anything in their power, no matter how despicable, to win. Seeds of doubt are sown between Kiritsugu Emiya and Saber, his Servant, as their conflicting ideologies on heroism and chivalry clash. Meanwhile, an ominous bond forms between Kirei Kotomine, who still seeks to find his purpose in life, and one of the remaining Servants. As the countdown to the end of the war reaches zero, the cost of winning begins to blur the line between victory and defeat. [Written by MAL Rewrite]",2012-04-08,https://cdn.myanimelist.net/images/anime/8/41125.jpg,8.58,596560.0
22,JoJo's Bizarre Adventure: Golden Wind,anime,David Production,"In the coastal city of Naples, corruption is teeming—the police blatantly conspire with outlaws, drugs run rampant around the youth, and the mafia governs the streets with an iron fist. However, various fateful encounters will soon occur. Enter Giorno Giovanna, a 15-year-old boy with an eccentric connection to the Joestar family, who makes a living out of part-time jobs and pickpocketing. Furthermore, he is gifted with the unexplained Stand ability to give and create life—growing plants from the ground and turning inanimate objects into live animals, an ability he has dubbed ""Gold Experience."" Fascinated by the might of local gangsters, Giorno has dreamed of rising up in their ranks and becoming a ""Gang-Star,"" a feat made possible by his encounter with Bruno Buccellati, a member of the Passione gang with his own sense of justice. JoJo no Kimyou na Bouken: Ougon no Kaze follows the endeavors of Giorno after joining Bruno's team while working under Passione, fending off other gangsters and secretly plotting to overthrow their mysterious boss. [Written by MAL Rewrite]",2018-10-06,https://cdn.myanimelist.net/images/anime/1572/95010.jpg,8.59,462021.0
