id,name,type,publisher,synopsis,released,img_link,avg_rating,qtd_rating
411,Looking for Alaska,livro,Speak,"Miles ""Pudge"" Halter is done with his safe life at home. His whole life has been one big non-event, and his obsession with famous last words has only made him crave âthe Great Perhapsâ even more (Francois Rabelais, poet). He heads off to the sometimes crazy and anything-but-boring world of Culver Creek Boarding School, and his life becomes the opposite of safe. Because down the hall is Alaska Young. The gorgeous, clever, funny, sexy, self-destructive, screwed up, and utterly fascinating Alaska Young. She is an event unto herself. She pulls Pudge into her world, launches him into the Great Perhaps, and steals his heart. Then. . . . After. Nothing is ever the same.",2005,https://i.gr-assets.com/images/S/compressed.photo.goodreads.com/books/1394798630l/99561.jpg,4.02,1113222.0
412,The Maze Runner,livro,Delacorte Press,"There are alternate cover editions for this ASIN here and here.If you ain't scared, you ain't human. When Thomas wakes up in the lift, the only thing he can remember is his name. He's surrounded by strangersâboys whose memories are also gone. Nice to meet ya, shank. Welcome to the Glade. Outside the towering stone walls that surround the Glade is a limitless, ever-changing maze. It's the only way outâand no one's ever made it through alive. Everything is going to change. Then a girl arrives. The first girl ever. And the message she delivers is terrifying. Remember. Survive. Run.",2009,https://i.gr-assets.com/images/S/compressed.photo.goodreads.com/books/1375596592l/6186357.jpg,4.03,1056076.0
413,The Book Thief,livro,Alfred A. Knopf,"Librarian's note: An alternate cover edition can be found hereIt is 1939. Nazi Germany. The country is holding its breath. Death has never been busier, and will be busier still.By her brother's graveside, Liesel's life is changed when she picks up a single object, partially hidden in the snow. It is The Gravedigger's Handbook, left behind there by accident, and it is her first act of book thievery. So begins a love affair with books and words, as Liesel, with the help of her accordian-playing foster father, learns to read. Soon she is stealing books from Nazi book-burnings, the mayor's wife's library, wherever there are books to be found.But these are dangerous times. When Liesel's foster family hides a Jew in their basement, Liesel's world is both opened up, and closed down.In superbly crafted writing that burns with intensity, award-winning author Markus Zusak has given us one of the most enduring stories of our time.(Note: this title was not published as YA fiction)",2005,https://i.gr-assets.com/images/S/compressed.photo.goodreads.com/books/1522157426l/19063._SY475_.jpg,4.37,1834276.0
414,"Hush, Hush",livro,Simon & Schuster BFYR,"Romance was not part of Nora Grey's plan. She's never been particularly attracted to the boys at her school, no matter how hard her best friend, Vee, pushes them at her. Not until Patch comes along. With his easy smile and eyes that seem to see inside her, Patch draws Nora to him against her better judgment.But after a series of terrifying encounters, Nora's not sure whom to trust. Patch seems to be everywhere she is and seems to know more about her than her closest friends. She can't decide whether she should fall into his arms or run and hide. And when she tries to seek some answers, she finds herself near a truth that is way more unsettling than anything Patch makes her feel.For she is right in the middle of an ancient battle between the immortal and those that have fallen - and, when it comes to choosing sides, the wrong choice will cost Nora her life.",2009,https://i.gr-assets.com/images/S/compressed.photo.goodreads.com/books/1358261334l/6339664.jpg,3.97,573419.0
415,Fangirl,livro,St. Martin's Griffin,"A coming-of-age tale of fan fiction, family and first love.
Cath is a Simon Snow fan.Okay, the whole world is a Simon Snow fan..But for Cath, being a fan is her lifeâand she's really good at it. She and her twin sister, Wren, ensconced themselves in the Simon Snow series when they were just kids; it's what got them through their mother leaving. Reading. Rereading. Hanging out in Simon Snow forums, writing Simon Snow fan fiction, dressing up like the characters for every movie premiere.Cath's sister has mostly grown away from fandom, but Cath can't let go. She doesn't want to.Now that they're going to college, Wren has told Cath she doesn't want to be roommates. Cath is on her own, completely outside of her comfort zone. She's got a surly roommate with a charming, always-around boyfriend, a fiction-writing professor who thinks fan fiction is the end of the civilized world, a handsome classmate who only wants to talk about words... And she can't stop worrying about her dad, who's loving and fragile and has never really been alone.For Cath, the question is: Can she do this? Can she make it without Wren holding her hand? Is she ready to start living her own life? Writing her own stories?And does she even want to move on if it means leaving Simon Snow behind?",2013,https://i.gr-assets.com/images/S/compressed.photo.goodreads.com/books/1355886270l/16068905.jpg,4.05,574854.0
416,Eleanor & Park,livro,St. Martin's Press,"Eleanor is the new girl in town, and with her chaotic family life, her mismatched clothes and unruly red hair, she couldn't stick out more if she tried.Park is the boy at the back of the bus. Black T-shirts, headphones, head in a book - he thinks he's made himself invisible. But not to Eleanor... never to Eleanor.Slowly, steadily, through late-night conversations and an ever-growing stack of mix tapes, Eleanor and Park fall for each other. They fall in love the way you do the first time, when you're young, and you feel as if you have nothing and everything to lose.",2012,https://i.gr-assets.com/images/S/compressed.photo.goodreads.com/books/1341952742l/15745753.jpg,4.05,860151.0
417,Graceling,livro,Harcourt,"Katsa has been able to kill a man with her bare hands since she was eightâshe's a Graceling, one of the rare people in her land born with an extreme skill. As niece of the king, she should be able to live a life of privilege, but Graced as she is with killing, she is forced to work as the king's thug. She never expects to fall in love with beautiful Prince Po. She never expects to learn the truth behind her Graceâor the terrible secret that lies hidden far away . . . a secret that could destroy all seven kingdoms with words alone. With elegant, evocative prose and a cast of unforgettable characters, debut author Kristin Cashore creates a mesmerizing world, a death-defying adventure, and a heart-racing romance that will consume you, hold you captive, and leave you wanting more.",2008,https://i.gr-assets.com/images/S/compressed.photo.goodreads.com/books/1331548394l/3236307.jpg,4.08,384727.0
418,Anna and the French Kiss,livro,Dutton Juvenile,"Anna is looking forward to her senior year in Atlanta, where she has a great job, a loyal best friend, and a crush on the verge of becoming more. Which is why she is less than thrilled about being shipped off to boarding school in Paris--until she meets Ãtienne St. Clair. Smart, charming, beautiful, Ãtienne has it all...including a serious girlfriend. But in the City of Light, wishes have a way of coming true. Will a year of romantic near-misses end with their long-awaited French kiss?",2010,https://i.gr-assets.com/images/S/compressed.photo.goodreads.com/books/1358271931l/6936382.jpg,4.01,363864.0
419,Throne of Glass,livro,Bloomsbury USA Children's,"After serving out a year of hard labor in the salt mines of Endovier for her crimes, 18-year-old assassin Celaena Sardothien is dragged before the Crown Prince. Prince Dorian offers her her freedom on one condition: she must act as his champion in a competition to find a new royal assassin.Her opponents are men-thieves and assassins and warriors from across the empire, each sponsored by a member of the king's council. If she beats her opponents in a series of eliminations, she'll serve the kingdom for four years and then be granted her freedom. Celaena finds her training sessions with the captain of the guard, Westfall, challenging and exhilarating. But she's bored stiff by court life. Things get a little more interesting when the prince starts to show interest in her ... but it's the gruff Captain Westfall who seems to understand her best.Then one of the other contestants turns up dead ... quickly followed by another. Can Celaena figure out who the killer is before she becomes a victim? As the young assassin investigates, her search leads her to discover a greater destiny than she could possibly have imagined.",2012,https://i.gr-assets.com/images/S/compressed.photo.goodreads.com/books/1495278054l/7896527.jpg,4.2,596208.0
420,Just Listen,livro,Viking Books,"Last year, Annabel was ""the girl who has everything"" at least that's the part she played in the television commercial for Kopf's Department Store.This year, she's the girl who has nothing: no best friend because mean-but-exciting Sophie dropped her, no peace at home since her older sister became anorexic, and no one to sit with at lunch. Until she meets Owen Armstrong. Tall, dark, and music-obsessed, Owen is a reformed bad boy with a commitment to truth-telling. With Owen's help, maybe Annabel can face what happened the night she and Sophie stopped being friends.",2006,https://i.gr-assets.com/images/S/compressed.photo.goodreads.com/books/1358270741l/51738.jpg,4.06,231380.0
421,Obsidian,livro,Entangled Teen,"Starting over sucks.When we moved to West Virginia right before my senior year, I'd pretty much resigned myself to thick accents, dodgy internet access, and a whole lot of boringâ¦ until I spotted my hot neighbor, with his looming height and eerie green eyes. Things were looking up.And then he opened his mouth.Daemon is infuriating. Arrogant. Stab-worthy. We do not get along. At all. But when a stranger attacks me and Daemon literally freezes time with a wave of his hand, well, somethingâ¦ unexpected happens. The hot alien living next door marks me.You heard me. Alien. Turns out Daemon and his sister have a galaxy of enemies wanting to steal their abilities, and Daemon's touch has me lit up like the Vegas Strip. The only way I'm getting out of this alive is by sticking close to Daemon until my alien mojo fades. If I don't kill him first, that is.",2011,https://i.gr-assets.com/images/S/compressed.photo.goodreads.com/books/1328275091l/12578077.jpg,4.18,225596.0
422,The Truth About Forever,livro,Penguin Group Inc.,"That's what Macy has to look forward to while her boyfriend, Jason, is away at Brain Camp. Days will be spent at a boring job in the library, evenings will be filled with vocabulary drills for the SATs, and spare time will be passed with her mother, the two of them sharing a silent grief at the traumatic loss of Macy's father.But sometimes, unexpected things can happenâthings such as the catering job at Wish, with its fun-loving, chaotic crew. Or her sister's project of renovating the neglected beach house, awakening long-buried memories. Things such as meeting Wes, a boy with a past, a taste for Truth-telling, and an amazing artistic talent, the kind of boy who could turn any girl's world upside down. As Macy ventures out of her shell, she begins to question her sheltered life.",2004,https://i.gr-assets.com/images/S/compressed.photo.goodreads.com/books/1362767907l/51737.jpg,4.12,208954.0
423,Daughter of Smoke & Bone,livro,"Little, Brown Books for Young Readers","Around the world, black hand prints are appearing on doorways, scorched there by winged strangers who have crept through a slit in the sky.In a dark and dusty shop, a devil's supply of human teeth grows dangerously low.And in the tangled lanes of Prague, a young art student is about to be caught up in a brutal otherworldly war.Meet Karou. She fills her sketchbooks with monsters that may or may not be real, she's prone to disappearing on mysterious ""errands"", she speaks many languages - not all of them human - and her bright blue hair actually grows out of her head that color. Who is she? That is the question that haunts her, and she's about to find out.When beautiful, haunted Akiva fixes fiery eyes on her in an alley in Marrakesh, the result is blood and starlight, secrets unveiled, and a star-crossed love whose roots drink deep of a violent past. But will Karou live to regret learning the truth about herself?",2011,https://i.gr-assets.com/images/S/compressed.photo.goodreads.com/books/1461353773l/8490112.jpg,4.01,310751.0
424,Howl's Moving Castle,livro,Harper Trophy,"An alternative cover for this ISBN can be found hereSophie has the great misfortune of being the eldest of three daughters, destined to fail miserably should she ever leave home to seek her fate. But when she unwittingly attracts the ire of the Witch of the Waste, Sophie finds herself under a horrid spell that transforms her into an old lady. Her only chance at breaking it lies in the ever-moving castle in the hills: the Wizard Howl's castle. To untangle the enchantment, Sophie must handle the heartless Howl, strike a bargain with a fire demon, and meet the Witch of the Waste head-on. Along the way, she discovers that there's far more to Howlâand herselfâthan first meets the eye.",1986,https://i.gr-assets.com/images/S/compressed.photo.goodreads.com/books/1407450489l/6294.jpg,4.26,215856.0
425,Pushing the Limits,livro,Harlequin Teen,"""I won't tell anyone, Echo. I promise."", Noah tucked a curl behind my ear. It had been so long since someone touched me like he did. Why did it have to be Noah Hutchins? His dark brown eyes shifted to my covered arms. ""You didn't do that-did you? It was done to you?"" No one ever asked that question. They stared. They whispered. They laughed. But they never asked.So wrong for each other...and yet so right.No one knows what happened the night Echo Emerson went from popular girl with jock boyfriend to gossiped-about outsider with ""freaky"" scars on her arms. Even Echo can't remember the whole truth of that horrible night. All she knows is that she wants everything to go back to normal. But when Noah Hutchins, the smoking-hot, girl-using loner in the black leather jacket, explodes into her life with his tough attitude and surprising understanding, Echo's world shifts in ways she could never have imagined. They should have nothing in common. And with the secrets they both keep, being together is pretty much impossible. Yet the crazy attraction between them refuses to go away. And Echo has to ask herself just how far they can push the limits and what she'll risk for the one guy who might teach her how to love again...",2012,https://i.gr-assets.com/images/S/compressed.photo.goodreads.com/books/1322770025l/10194514.jpg,4.06,114086.0
426,Born at Midnight,livro,St. Martin's Griffin,"Don't miss this spectacular new series that will steal your heart and haunt your dreams, Welcome to Shadow Falls camp, nestled deep in the woods of a town called Fallenâ¦One night Kylie Galen finds herself at the wrong party, with the wrong people, and it changes her life forever. Her mother ships her off to Shadow Fallsâa camp for troubled teens, and within hours of arriving, it becomes painfully clear that her fellow campers aren't just âtroubled.â Here at Shadow Falls, vampires, werewolves, shapeshifters, witches and fairies train side by sideâlearning to harness their powers, control their magic and live in the normal world.Kylie's never felt normal, but surely she doesn't belong here with a bunch of paranormal freaks either. Or does she? They insist Kylie is one of them, and that she was brought here for a reason. As if life wasn't complicated enough, enter Derek and Lucas. Derek's a half-fae who's determined to be her boyfriend, and Lucas is a smokin' hot werewolf with whom Kylie shares a secret past. Both Derek and Lucas couldn't be more different, but they both have a powerful hold on her heart. Even though Kylie feels deeply uncertain about everything, one thing is becoming painfully clearâShadow Falls is exactly where she belongsâ¦",2011,https://i.gr-assets.com/images/S/compressed.photo.goodreads.com/books/1546092698l/8705784._SY475_.jpg,4.12,81877.0
427,Rubinrot,livro,Arena Verlag,"Manchmal ist es ein echtes Kreuz, in einer Familie zu leben, die jede Menge Geheimnisse hat. Der Ãberzeugung ist zumindest die 16-jÃ¤hrige Gwendolyn.Bis sie sich eines Tages aus heiterem Himmel im London um die letzte Jahrhundertwende wiederfindet. Und ihr klar wird, dass ausgerechnet sie das allergrÃ¶Ãte Geheimnis ihrer Familie ist. Was ihr dagegen nicht klar ist: Dass man sich zwischen den Zeiten mÃ¶glichst nicht verlieben sollte. Denn das macht die Sache erst recht kompliziert!",2009,https://i.gr-assets.com/images/S/compressed.photo.goodreads.com/books/1327918185l/6325285.jpg,4.1,111928.0
428,A Court of Thorns and Roses,livro,Bloomsbury USA Childrens,"Feyre's survival rests upon her ability to hunt and kill and the forest where she lives is a cold, bleak place in the long winter months. So when she spots a deer in the forest being pursued by a wolf, she cannot resist fighting it for the flesh. But to do so, she must kill the predator and killing something so precious comes at a price ...Dragged to a magical kingdom for the murder of a faerie, Feyre discovers that her captor, his face obscured by a jewelled mask, is hiding far more than his piercing green eyes would suggest. Feyre's presence at the court is closely guarded, and as she begins to learn why, her feelings for him turn from hostility to passion and the faerie lands become an even more dangerous place. Feyre must fight to break an ancient curse, or she will lose him forever.",2015,https://i.gr-assets.com/images/S/compressed.photo.goodreads.com/books/1546406962l/16096824._SY475_.jpg,4.22,476270.0
429,The Outsiders,livro,Puffin Books (US/CAN),"The Outsiders is about two weeks in the life of a 14-year-old boy. The novel tells the story of Ponyboy Curtis and his struggles with right and wrong in a society in which he believes that he is an outsider. According to Ponyboy, there are two kinds of people in the world: greasers and socs. A soc (short for ""social"") has money, can get away with just about anything, and has an attitude longer than a limousine. A greaser, on the other hand, always lives on the outside and needs to watch his back. Ponyboy is a greaser, and he's always been proud of it, even willing to rumble against a gang of socs for the sake of his fellow greasers--until one terrible night when his friend Johnny kills a soc. The murder gets under Ponyboy's skin, causing his bifurcated world to crumble and teaching him that pain feels the same whether a soc or a greaser.Librarian note: This record is for one of the three editions published with different covers and with ISBN 0-140-38572-X / 978-0-14-038572-4. The records are for the 1988 cover (this record), the 1995 cover, and the 2008 cover which is also the current in-print cover.",1967,https://i.gr-assets.com/images/S/compressed.photo.goodreads.com/books/1442129426l/231804.jpg,4.1,938150.0
430,Legend,livro,Putnam Juvenile,"What was once the western United States is now home to the Republic, a nation perpetually at war with its neighbors. Born into an elite family in one of the Republic's wealthiest districts, fifteen-year-old June is a prodigy being groomed for success in the Republic's highest military circles. Born into the slums, fifteen-year-old Day is the country's most wanted criminal. But his motives may not be as malicious as they seem.From very different worlds, June and Day have no reason to cross pathsâuntil the day June's brother, Metias, is murdered and Day becomes the prime suspect. Caught in the ultimate game of cat and mouse, Day is in a race for his family's survival, while June seeks to avenge Metias's death. But in a shocking turn of events, the two uncover the truth of what has really brought them together, and the sinister lengths their country will go to keep its secrets.Alternate Cover edition for ISBN 9780399256752",2011,https://i.gr-assets.com/images/S/compressed.photo.goodreads.com/books/1501368160l/9275658.jpg,4.17,411041.0
431,A Tree Grows in Brooklyn,livro,HarperCollins Publishers,"The beloved American classic about a young girl's coming-of-age at the turn of the century, Betty Smith's A Tree Grows in Brooklyn is a poignant and moving tale filled with compassion and cruelty, laughter and heartache, crowded with life and people and incident. The story of young, sensitive, and idealistic Francie Nolan and her bittersweet formative years in the slums of Williamsburg has enchanted and inspired millions of readers for more than sixty years. By turns overwhelming, sublime, heartbreaking, and uplifting, the daily experiences of the unforgettable Nolans are raw with honesty and tenderly threaded with family connectedness -- in a work of literary art that brilliantly captures a unique time and place as well as incredibly rich moments of universal experience.",1943,https://i.gr-assets.com/images/S/compressed.photo.goodreads.com/books/1327883484l/14891.jpg,4.27,388454.0
432,Cinder,livro,Feiwel & Friends,"Humans and androids crowd the raucous streets of New Beijing. A deadly plague ravages the population. From space, a ruthless Lunar people watch, waiting to make their move. No one knows that Earth's fate hinges on one girl. . . . Cinder, a gifted mechanic, is a cyborg. She's a second-class citizen with a mysterious past, reviled by her stepmother and blamed for her stepsister's illness. But when her life becomes intertwined with the handsome Prince Kai's, she suddenly finds herself at the center of an intergalactic struggle, and a forbidden attraction. Caught between duty and freedom, loyalty and betrayal, she must uncover secrets about her past in order to protect her world's future.",2012,https://i.gr-assets.com/images/S/compressed.photo.goodreads.com/books/1507557775l/36381037.jpg,4.14,682555.0
433,It's Kind of a Funny Story,livro,Disney-Hyperion,"Ambitious New York City teenager Craig Gilner is determined to succeed at life - which means getting into the right high school to get into the right job. But once Craig aces his way into Manhattan's Executive Pre-Professional High School, the pressure becomes unbearable. He stops eating and sleeping until, one night, he nearly kills himself.Craig's suicidal episode gets him checked into a mental hospital, where his new neighbors include a transsexual sex addict, a girl who has scarred her own face with scissors, and the self-elected President Armelio. There, Craig is finally able to confront the sources of his anxiety.Ned Vizzini, who himself spent time in a psychiatric hospital, has created a remarkably moving tale about the sometimes unexpected road to happiness.",2006,https://i.gr-assets.com/images/S/compressed.photo.goodreads.com/books/1420629730l/248704.jpg,4.11,210996.0
434,The Angel Experiment,livro,Grand Central Publishing,"Six unforgettable kids ""with no families, no homes"" are running for their lives. Max Ride and her best friends have the ability to fly. And that's just the beginning of their amazing powers. But they don't know where they come from, who's hunting them, why they are different from all other humans... and if they're meant to save mankind â or destroy it.",2005,https://i.gr-assets.com/images/S/compressed.photo.goodreads.com/books/1339277875l/13152.jpg,4.07,205771.0
435,Unearthly,livro,HarperTeen,"In the beginning, there's a boy standing in the trees...Clara Gardner has recently learned that she's part angel. Having angel blood run through her veins not only makes her smarter, stronger, and faster than humans (a word, she realizes, that no longer applies to her), but it means she has a purpose, something she was put on this earth to do. Figuring out what that is, though, isn't easy.Her visions of a raging forest fire and an alluring stranger lead her to a new school in a new town. When she meets Christian, who turns out to be the boy of her dreams (literally), everything seems to fall into place and out of place at the same time. Because there's another guy, Tucker, who appeals to Clara's less angelic side.As Clara tries to find her way in a world she no longer understands, she encounters unseen dangers and choices she never thought she'd have to make between honesty and deceit, love and duty, good and evil. When the fire from her vision finally ignites, will Clara be ready to face her destiny?Unearthly is a moving tale of love and fate, and the struggle between following the rules and following your heart.",2011,https://i.gr-assets.com/images/S/compressed.photo.goodreads.com/books/1324782984l/7488244.jpg,4.02,121427.0
436,Under the Never Sky,livro,Atom,"Aria has lived her whole life in the protected dome of Reverie. Her entire world confined to its spaces, she's never thought to dream of what lies beyond its doors. So when her mother goes missing, Aria knows her chances of surviving in the outer wasteland long enough to find her are slim.Then Aria meets an outsider named Perry. He's searching for someone too. He's also wild - a savage - but might be her best hope at staying alive.If they can survive, they are each other's best hope for finding answers.",2011,https://i.gr-assets.com/images/S/compressed.photo.goodreads.com/books/1356591725l/11594257.jpg,3.99,108446.0
