id,name,type,publisher,synopsis,released,img_link,avg_rating,qtd_rating
73,Gintama.: Slip Arc,anime,Bandai Namco Pictures,"Following the grim events of Iga, Kokujou Island, Rakuyou, and multiple fruitless confrontations with the Tenshouin Naraku and Tendoshuu, Gintama.: Porori-hen takes its viewers on a trip down memory lane to when Yorozuya were mostly doing what they did best—odd jobs. The great space hunter Umibouzu has returned to Edo and is livid when he finds out that his daughter Kagura has a boyfriend. He blames Gintoki for being an incompetent guardian, but has the time finally come for him to let go of his daughter? Back with shameless parodies, risqué humor, and lively camaraderie, Gintoki, Kagura, and Shinpachi are faced with unforeseen situations that manage to be both hilarious and emotionally stirring. [Written by MAL Rewrite]",2017-10-02,https://cdn.myanimelist.net/images/anime/11/88325.jpg,8.53,76928.0
74,Made in Abyss,anime,Kinema Citrus,"The Abyss—a gaping chasm stretching down into the depths of the earth, filled with mysterious creatures and relics from a time long past. How did it come to be? What lies at the bottom? Countless brave individuals, known as Divers, have sought to solve these mysteries of the Abyss, fearlessly descending into its darkest realms. The best and bravest of the Divers, the White Whistles, are hailed as legends by those who remain on the surface. Riko, daughter of the missing White Whistle Lyza the Annihilator, aspires to become like her mother and explore the furthest reaches of the Abyss. However, just a novice Red Whistle herself, she is only permitted to roam its most upper layer. Even so, Riko has a chance encounter with a mysterious robot with the appearance of an ordinary young boy. She comes to name him Reg, and he has no recollection of the events preceding his discovery. Certain that the technology to create Reg must come from deep within the Abyss, the two decide to venture forth into the chasm to recover his memories and see the bottom of the great pit with their own eyes. However, they know not of the harsh reality that is the true existence of the Abyss. [Written by MAL Rewrite]",2017-07-07,https://cdn.myanimelist.net/images/anime/6/86733.jpg,8.7,547165.0
75,Fighting Spirit: New Challenger,anime,Madhouse,"Japanese Featherweight Champion Ippo Makunouchi has successfully defended and retained his title. Meanwhile, his rival, Ichirou Miyata, has resurfaced in Japan, aiming for his own Featherweight belt in the Oriental Pacific Boxing Federation. When the rest of the world comes knocking, however, will Japan's best fighters rise to the challenge and achieve glory at the top? Or will the small island nation be crushed under the weight of greater entities? This time, champions will become challengers issuing a call to the rest of the world and ready to show off their fighting spirit! [Written by MAL Rewrite]",2009-01-07,https://cdn.myanimelist.net/images/anime/8/56617.jpg,8.66,133296.0
76,Natsume's Book of Friends Season 6,anime,Shuka,"Takashi Natsume has grown accustomed to his encounters with youkai through the Book of Friends, which contains the names of youkai whom his grandmother, Reiko Natsume, has sealed in contracts. These encounters allow Natsume to better understand the youkai, Reiko, and himself. The Book of Friends is a powerful tool that can be used to control youkai; it is sought after by both youkai and exorcists alike. Natsume just wants to live out his daily life in peace but is constantly disrupted by these experiences. If he is to end this torment, Natsume must explore more about the book and the world of exorcism, as well as begin to open his heart to those who can help him. [Written by MAL Rewrite]",2017-04-12,https://cdn.myanimelist.net/images/anime/6/84416.jpg,8.63,54269.0
77,A Silent Voice,anime,Kyoto Animation,"As a wild youth, elementary school student Shouya Ishida sought to beat boredom in the cruelest ways. When the deaf Shouko Nishimiya transfers into his class, Shouya and the rest of his class thoughtlessly bully her for fun. However, when her mother notifies the school, he is singled out and blamed for everything done to her. With Shouko transferring out of the school, Shouya is left at the mercy of his classmates. He is heartlessly ostracized all throughout elementary and middle school, while teachers turn a blind eye. Now in his third year of high school, Shouya is still plagued by his wrongdoings as a young boy. Sincerely regretting his past actions, he sets out on a journey of redemption: to meet Shouko once more and make amends. Koe no Katachi tells the heartwarming tale of Shouya's reunion with Shouko and his honest attempts to redeem himself, all while being continually haunted by the shadows of his past. [Written by MAL Rewrite]",2016-09-17,https://cdn.myanimelist.net/images/anime/1122/96435.jpg,8.97,1239283.0
78,Kizumonogatari Part 2: Hot-Blooded,anime,Shaft,"No longer truly human, Koyomi Araragi decides to retrieve Kiss-shot Acerola-orion Heart-under-blade's severed body parts that were stolen by three powerful vampire hunters. Awaiting him are Dramaturgie, a vampire hunter who is a vampire himself; Episode, a half-vampire with the ability to transform into mist; and Guillotinecutter, a human priest who is the most dangerous of them all. Unbeknownst to Araragi, each minute he spends trying to retrieve Kiss-shot's limbs makes him less of a human and more of a vampire. Will he be able to keep his wish of becoming human once again by the end of his battles? [Written by MAL Rewrite]",2016-08-19,https://cdn.myanimelist.net/images/anime/8/80930.jpg,8.6,216591.0
79,Legend of the Galactic Heroes,anime,K-Factory,"The 150-year-long stalemate between the two interstellar superpowers, the Galactic Empire and the Free Planets Alliance, comes to an end when a new generation of leaders arises: the idealistic military genius Reinhard von Lohengramm, and the FPA's reserved historian, Yang Wenli. While Reinhard climbs the ranks of the Empire with the aid of his childhood friend, Siegfried Kircheis, he must fight not only the war, but also the remnants of the crumbling Goldenbaum Dynasty in order to free his sister from the Kaiser and unify humanity under one genuine ruler. Meanwhile, on the other side of the galaxy, Yang—a strong supporter of democratic ideals—has to stand firm in his beliefs, despite the struggles of the FPA, and show his pupil, Julian Mintz, that autocracy is not the solution. As ideologies clash amidst the war's many casualties, the two strategic masterminds must ask themselves what the real reason behind their battle is. [Written by MAL Rewrite]",1988-01-08,https://cdn.myanimelist.net/images/anime/13/13225.jpg,9.04,58857.0
80,Jujutsu Kaisen (TV),anime,MAPPA,"Idly indulging in baseless paranormal activities with the Occult Club, high schooler Yuuji Itadori spends his days at either the clubroom or the hospital, where he visits his bedridden grandfather. However, this leisurely lifestyle soon takes a turn for the strange when he unknowingly encounters a cursed item. Triggering a chain of supernatural occurrences, Yuuji finds himself suddenly thrust into the world of Curses—dreadful beings formed from human malice and negativity—after swallowing the said item, revealed to be a finger belonging to the demon Sukuna Ryoumen, the ""King of Curses."" Yuuji experiences first-hand the threat these Curses pose to society as he discovers his own newfound powers. Introduced to the Tokyo Metropolitan Jujutsu Technical High School, he begins to walk down a path from which he cannot return—the path of a Jujutsu sorcerer. [Written by MAL Rewrite]",2020-10-03,https://cdn.myanimelist.net/images/anime/1171/109222.jpg,8.72,921010.0
81,Fighting Spirit,anime,Madhouse,"Makunouchi Ippo has been bullied his entire life. Constantly running errands and being beaten up by his classmates, Ippo has always dreamed of changing himself, but never has the passion to act upon it. One day, in the midst of yet another bullying, Ippo is saved by Takamura Mamoru, who happens to be a boxer. Ippo faints from his injuries and is brought to the Kamogawa boxing gym to recover. As he regains consciousness, he is awed and amazed at his new surroundings in the gym, though lacks confidence to attempt anything. Takamura places a photo of Ippo's classmate on a punching bag and forces him to punch it. It is only then that Ippo feels something stir inside him and eventually asks Takamura to train him in boxing. Thinking that Ippo does not have what it takes, Takamura gives him a task deemed impossible and gives him a one week time limit. With a sudden desire to get stronger, for himself and his hard working mother, Ippo trains relentlessly to accomplish the task within the time limit. Thus Ippo's journey to the top of the boxing world begins. [Written by MAL Rewrite]",2000-10-04,https://cdn.myanimelist.net/images/anime/4/86334.jpg,8.74,210374.0
82,Showa Genroku Rakugo Shinju,anime,Studio Deen,"Yotarou is a former yakuza member fresh out of prison and fixated on just one thing: rather than return to a life of crime, the young man aspires to take to the stage of rakugo, a traditional Japanese form of comedic storytelling. Inspired during his incarceration by the performance of distinguished practitioner Yakumo Yuurakutei, he sets his mind on meeting the man who changed his life. After hearing Yotarou's desperate appeal for his mentorship, Yakumo is left with no choice but to accept his very first apprentice. As he eagerly begins his training, Yotarou meets Konatsu, an abrasive young woman who has been under Yakumo's care ever since her beloved father Sukeroku Yuurakutei, another prolific rakugo performer, passed away. Through her hidden passion, Yotarou is drawn to Sukeroku's unique style of rakugo despite learning under contrasting techniques. Upon seeing this, old memories and feelings return to Yakumo who reminisces about a much earlier time when he made a promise with his greatest rival. Shouwa Genroku Rakugo Shinjuu is a story set in both the past and present, depicting the art of rakugo, the relationships it creates, and the lives and hearts of those dedicated to keeping the unique form of storytelling alive. [Written by MAL Rewrite]",2016-01-09,https://cdn.myanimelist.net/images/anime/2/77907.jpg,8.59,79646.0
83,Natsume's Book of Friends Season 2,anime,Brain's Base,"As with its prequel, Zoku Natsume Yuujinchou is about Takashi Natsume, a boy who has had the ability to see youkai since he was young, and his bodyguard youkai Madara, nicknamed Nyanko-sensei. Natsume attempts to return names written in his ""Book of Friends"" (which he inherited from his grandmother Reiko) to youkai in his village. Throughout these adventures, he meets some youkai that are friendly, some that want to steal the Book, and some that want to kill him, as Natsume learns about himself and his relationship with these mysterious beings along the way. [Written by MAL Rewrite]",2009-01-06,https://cdn.myanimelist.net/images/anime/4/79738.jpg,8.56,109842.0
84,Fruits Basket: The Final,anime,TMS Entertainment,"Hundreds of years ago, the Chinese Zodiac spirits and their god swore to stay together eternally. United by this promise, the possessed members of the Souma family shall always return to each other under any circumstances. Yet, when these bonds shackle them from freedom, it becomes an undesirable burden—a curse. As head of the clan, Akito is convinced that he shares a special connection with the other Soumas. While he desperately clings to this fantasy, the rest of the family remains isolated and suppressed by the fear of punishment. Tooru Honda, who has grown attached to the Soumas, is determined to break the chains that bind them. Her companionship with the family and her friends encourages her to move forward with lifting the curse. However, due to confounding revelations, she struggles to find the tenacity to continue her endeavors. With time slowly withering away, Tooru contends with an uncertain future in hopes of reaching the tranquility that may lie beyond all this commotion. [Written by MAL Rewrite]",2021-04-06,https://cdn.myanimelist.net/images/anime/1085/114792.jpg,9.06,118724.0
85,Attack on Titan: The Final Season,anime,MAPPA,"Gabi Braun and Falco Grice have been training their entire lives to inherit one of the seven titans under Marley's control and aid their nation in eradicating the Eldians on Paradis. However, just as all seems well for the two cadets, their peace is suddenly shaken by the arrival of Eren Yeager and the remaining members of the Survey Corps. Having finally reached the Yeager family basement and learned about the dark history surrounding the titans, the Survey Corps has at long last found the answer they so desperately fought to uncover. With the truth now in their hands, the group set out for the world beyond the walls. In Shingeki no Kyojin: The Final Season, two utterly different worlds collide as each party pursues its own agenda in the long-awaited conclusion to Paradis' fight for freedom. [Written by MAL Rewrite]",2020-12-07,https://cdn.myanimelist.net/images/anime/1000/110531.jpg,8.9,812495.0
86,Great Teacher Onizuka,anime,Studio Pierrot,"Twenty-two-year-old Eikichi Onizuka—ex-biker gang leader, conqueror of Shonan, and virgin—has a dream: to become the greatest high school teacher in all of Japan. This isn't because of a passion for teaching, but because he wants a loving teenage wife when he's old and gray. Still, for a perverted, greedy, and lazy delinquent, there is more to Onizuka than meets the eye. So when he lands a job as the homeroom teacher of the Class 3-4 at the prestigious Holy Forest Academy—despite suplexing the Vice Principal—all of his talents are put to the test, as this class is particularly infamous. Due to their utter contempt for all teachers, the class' students use psychological warfare to mentally break any new homeroom teacher they get, forcing them to quit and leave school. However, Onizuka isn't your average teacher, and he's ready for any challenge in his way. Bullying, suicide, and sexual harassment are just a few of the issues his students face daily. By tackling the roots of their problems, Onizuka supports them with his unpredictable and unconventional methods—even if it means jumping off a building to save a suicidal child. Thanks to his eccentric charm and fun-loving nature, Class 3-4 slowly learns just how enjoyable school can be when you're the pupils of the Great Teacher Onizuka. [Written by MAL Rewrite]",1999-06-3,https://cdn.myanimelist.net/images/anime/13/11460.jpg,8.69,322548.0
87,MUSHI-SHI -Next Passage-,anime,Artland,"Perceived as strange and feared by man, over time the misshapen ones came to be known as Mushi. Although they harbor no ill intentions towards humans, many suffer from the side effects of their existence and strange nature; exploiting the Mushi without understanding them, even unintentionally, can lead to disaster and strife for any involved. Mushishi Zoku Shou continues the story of Mushishi Ginko on his journey to help the visible world to coexist with the Mushi. During his travels, Ginko discovers various gifted individuals—those cursed by circumstance and those maintaining a fragile symbiosis with the Mushi—inevitably confronting the question of whether humanity, talented and tortured alike, can manage the responsibility of the unseen. Moreover, as a Mushishi, Ginko must learn more about these strange beings and decide if he has the right to interfere with the complex relationships between Mushi and mankind. [Written by MAL Rewrite]",2014-04-05,https://cdn.myanimelist.net/images/anime/13/58533.jpg,8.71,99502.0
88,A Place Further Than The Universe,anime,Madhouse,"Filled with an overwhelming sense of wonder for the world around her, Mari Tamaki has always dreamt of what lies beyond the reaches of the universe. However, despite harboring such large aspirations on the inside, her fear of the unknown and anxiety over her own possible limitations have always held her back from chasing them. But now, in her second year of high school, Mari is more determined than ever to not let any more of her youth go to waste. Still, her fear continues to prevent her from taking that ambitious step forward—that is, until she has a chance encounter with a girl who has grand dreams of her own. Spurred by her mother's disappearance, Shirase Kobuchizawa has been working hard to fund her trip to Antarctica. Despite facing doubt and ridicule from virtually everyone, Shirase is determined to embark on this expedition to search for her mother in a place further than the universe itself. Inspired by Shirase's resolve, Mari jumps at the chance to join her. Soon, their efforts attract the attention of the bubbly Hinata Miyake, who is eager to stand out, and Yuzuki Shiraishi, a polite girl from a high class background. Together, they set sail toward the frozen south. Sora yori mo Tooi Basho follows the captivating journey of four spirited girls, all in search of something great. [Written by MAL Rewrite]",2018-01-02,https://cdn.myanimelist.net/images/anime/6/89879.jpg,8.55,172116.0
89,March Comes In Like A Lion 2nd Season,anime,Shaft,"Now in his second year of high school, Rei Kiriyama continues pushing through his struggles in the professional shogi world as well as his personal life. Surrounded by vibrant personalities at the shogi hall, the school club, and in the local community, his solitary shell slowly begins to crack. Among them are the three Kawamoto sisters—Akari, Hinata, and Momo—who forge an affectionate and familial bond with Rei. Through these ties, he realizes that everyone is burdened by their own emotional hardships and begins learning how to rely on others while supporting them in return. Nonetheless, the life of a professional is not easy. Between tournaments, championships, and title matches, the pressure mounts as Rei advances through the ranks and encounters incredibly skilled opponents. As he manages his relationships with those who have grown close to him, the shogi player continues to search for the reason he plays the game that defines his career. [Written by MAL Rewrite]",2017-10-14,https://cdn.myanimelist.net/images/anime/3/88469.jpg,8.97,156965.0
90,Natsume's Book of Friends Season 3,anime,Brain's Base,"Natsume Yuujinchou San follows Takashi Natsume, a boy who is able to see youkai. Natsume and his bodyguard Madara, nicknamed Nyanko-sensei, continue on their quest to release youkai from their contracts in the ""Book of Friends."" Natsume comes to terms with his ability to see youkai and stops thinking of it as a curse. As he spends more time with his human and youkai friends, he realizes how much he values them both and decides he doesn't have to choose between the spirit and human worlds to be happy. [Written by MAL Rewrite]",2011-07-05,https://cdn.myanimelist.net/images/anime/8/82394.jpg,8.58,102200.0
91,Fruits Basket 2nd Season,anime,TMS Entertainment,"A year has passed since Tooru Honda began living in the Souma residence, and she has since created stronger relationships with its inhabitants Shigure, Kyou, and Yuki. She has also grown closer to the rest of the Souma family and has become familiar with their ancestral secret, having helped them with many of their personal issues. The closer Tooru gets, however, the more she begins to realize that their secret holds a darker truth than she first presumed. Summer is approaching and Tooru is invited to spend her days with the Soumas, mainly Kyou and Yuki. Tooru wishes for an easy-going vacation, but her close relationships with the two boys and the rest of the Soumas may prove to cause trouble. As they grow more intimate, their carefree time together is hindered by older hardships and feelings from the past that begin to resurface. The Eternal Banquet also dawns on the members of the zodiac, and they must tend to their duties alongside the unnerving head of the family, Akito Souma. With the banquet approaching and a plethora of feelings to be solved, will Tooru's life with the Soumas remain peaceful, or will she find herself in a situation from which she cannot escape? [Written by MAL Rewrite]",2020-04-07,https://cdn.myanimelist.net/images/anime/1972/111635.jpg,8.57,152568.0
92,Cowboy Bebop,anime,Sunrise,"In the year 2071, humanity has colonized several of the planets and moons of the solar system leaving the now uninhabitable surface of planet Earth behind. The Inter Solar System Police attempts to keep peace in the galaxy, aided in part by outlaw bounty hunters, referred to as ""Cowboys."" The ragtag team aboard the spaceship Bebop are two such individuals. Mellow and carefree Spike Spiegel is balanced by his boisterous, pragmatic partner Jet Black as the pair makes a living chasing bounties and collecting rewards. Thrown off course by the addition of new members that they meet in their travels—Ein, a genetically engineered, highly intelligent Welsh Corgi; femme fatale Faye Valentine, an enigmatic trickster with memory loss; and the strange computer whiz kid Edward Wong—the crew embarks on thrilling adventures that unravel each member's dark and mysterious past little by little. Well-balanced with high density action and light-hearted comedy, Cowboy Bebop is a space Western classic and an homage to the smooth and improvised music it is named after. [Written by MAL Rewrite]",1998-04-03,https://cdn.myanimelist.net/images/anime/4/19644.jpg,8.77,725556.0
93,Rocky Joe 2,anime,Tokyo Movie Shinsha,"Yabuki Joe is left downhearted and hopeless after a certain tragic event. In attempt to put the past behind him, Joe leaves the gym behind and begins wandering. On his travels he comes across the likes of Wolf Kanagushi and Goromaki Gondo, men who unintentionally fan the dying embers inside him, leading him to putting his wanderings to an end. His return home puts Joe back on the path to boxing, but unknown to himself and his trainer, he now suffers deep-set issues holding him back from fighting. In attempt to quell those issues, Carlos Rivera, a world renowned boxer is invited from Venezuela to help Joe recover.",1980-10-13,https://cdn.myanimelist.net/images/anime/3/45028.jpg,8.69,14155.0
94,Bakuman.,anime,J.C.Staff,"Onto their third serialization, manga duo Moritaka Mashiro and Akito Takagi—also known by their pen name, Muto Ashirogi—are ever closer to their dream of an anime adaption. However, the real challenge is only just beginning: if they are unable to compete with the artist Eiji Niizuma in the rankings within the span of six months, they will be canceled. To top it off, numerous rivals are close behind and declaring war. They don't even have enough time to spare thinking about an anime! In Bakuman. 3rd Season, Muto Ashirogi must find a way to stay atop the colossal mountain known as the Shounen Jack rankings. With new problems and new assistants, the pair continue to strive for their dream. [Written by MAL Rewrite]",2012-10-06,https://cdn.myanimelist.net/images/anime/6/41845.jpg,8.56,171135.0
95,The Promised Neverland,anime,CloverWorks,"Surrounded by a forest and a gated entrance, the Grace Field House is inhabited by orphans happily living together as one big family, looked after by their ""Mama,"" Isabella. Although they are required to take tests daily, the children are free to spend their time as they see fit, usually playing outside, as long as they do not venture too far from the orphanage—a rule they are expected to follow no matter what. However, all good times must come to an end, as every few months, a child is adopted and sent to live with their new family, never to be heard from again. However, the three oldest siblings have their suspicions about what is actually happening at the orphanage, and they are about to discover the cruel fate that awaits the children living at Grace Field, including the twisted nature of their beloved Mama. [Written by MAL Rewrite]",2019-01-1,https://cdn.myanimelist.net/images/anime/1830/118780.jpg,8.57,980031.0
96,The Tatami Galaxy,anime,Madhouse,"One autumn evening at a mysterious ramen stand behind the Shimogamo Shrine, a lonely third-year college student bumps into a man with an eggplant-shaped head who calls himself a god of matrimony. Meeting this man causes the student to reflect upon his past two years at college—two years bitterly spent trying to break up couples on campus with his only friend Ozu, a ghoulish-looking man seemingly set on making his life as miserable as possible. Resolving to make the most out of the rest of his college life, the student attempts to ask out the unsociable but kind-hearted underclassman Akashi, yet fails to follow through, prompting him to regret not living out his college life differently. As soon as this thought passes through his head, however, he is hurtled through time and space to the beginning of his years at college and given another chance to live his life. Surreal, artistic, and mind-bending, Yojouhan Shinwa Taikei chronicles the misadventures of a young man on a journey to make friends, find love, and experience the rose-colored campus life he always dreamed of. [Written by MAL Rewrite]",2010-04-23,https://cdn.myanimelist.net/images/anime/10/50457.jpg,8.58,115921.0
